<?xml version="1.0" standalone="no"?>
<!DOCTYPE input SYSTEM "../../dtd/pb_input.dtd">

<input>
  <experiment>order_TEST</experiment>
  
  <tabular_location>
    <match># p</match>
    <skip>1</skip>
    
    <tabular_value>
      <name>p</name>
      <pos>0</pos>
    </tabular_value>
    
    <tabular_value>
      <name>r</name>
      <pos>1</pos>
    </tabular_value>
    
  </tabular_location>

  <named_location>
    <name>T</name>
    <match>T =</match>
  </named_location>

</input>
