<?xml version="1.0" standalone="no"?>
<!DOCTYPE input SYSTEM "../../../perfbase/dtd/pb_input.dtd">

<input>
  <experiment>iozone_DEMO</experiment>
  <description>import output files that have been generated with the "-t" option.</description>

  <fixed_value>
    <name>mode</name>
    <content>throughput</content>
  </fixed_value>

  <named_location mode="abort">
    <name>host</name> <!-- dummy value -->
    <match>reclen   write rewrite    read</match>
  </named_location>

  <named_location>
    <name>N_tp</name>
    <match>Throughput test with</match>
  </named_location>

  <fixed_value>
    <name>N_nodes</name>
    <content>1</content>
  </fixed_value>

  <!-- parse uname output -->
  <tabular_location rows="1">
    <match>Machine =</match>

    <tabular_value>
      <name>OS</name>
      <pos>2</pos>
    </tabular_value>
    <tabular_value>
      <name>host</name>
      <pos>3</pos>
    </tabular_value>
    <tabular_value>
      <name>OS_version</name>
      <pos>4</pos>
    </tabular_value>
  </tabular_location>

  <filename_location>
    <name>fs</name>
  </filename_location>  
  
  <named_location>
    <name>iozone_version</name>
    <match>$Revision:</match>
  </named_location>

  <named_location len="0">
    <name>iozone_args</name>
    <match>Command line used:</match>
  </named_location>

  <named_location len="0">
    <name>date_run</name>
    <match>Run began:</match>
  </named_location>

  <named_location>
    <name>path</name>
    <match>-f</match>
  </named_location>

  <named_location>
    <name>S_stride</name>
    <match>stride size set to</match>
  </named_location>

  <named_location>
    <name>S_file</name>
    <match>Each process writes a</match>
  </named_location>

  <named_location>
    <name>S_record</name>
    <match>file in</match>
  </named_location>

  <named_location mode="boolean">
    <name>lock_file</name>
    <match>Lock file when reading/writing.</match>
  </named_location>

  <named_location mode="boolean">
    <name>lock_record</name>
    <match>Record locking mode enabled</match>
  </named_location>

  <named_location mode="boolean">
    <name>inc_close</name>
    <match>-c</match>
  </named_location>

  <!-- *** -->
  <!-- *** set access type -->
  <!-- *** -->
  <named_location>
    <name>acc</name>
    <match terminator="=">Children see throughput for</match>

    <map>
      <content_in match="regexp">.*initial writers.*</content_in>
      <content_out>write</content_out>
    </map>
    <map>
      <content_in match="regexp">.*rewriters.*</content_in>
      <content_out>rewrite</content_out>
    </map>
    <map>
      <content_in match="regexp">.*re-readers.*</content_in>
      <content_out>reread</content_out>
    </map>
    <map>
      <content_in match="regexp">.*reverse readers.*</content_in>
      <content_out>bkwd_read</content_out>
    </map>
    <map>
      <content_in match="regexp">.*stride readers.*</content_in>
      <content_out>stride_read</content_out>
    </map>
    <map>
      <content_in match="regexp">.*random readers.*</content_in>
      <content_out>random_read</content_out>
    </map>
    <map>
      <content_in match="regexp">.*mixed workload.*</content_in>
      <content_out>mixed</content_out>
    </map>
    <map>
      <content_in match="regexp">.*random writers.*</content_in>
      <content_out>random_write</content_out>
    </map>
    <!-- this entry at the end as it matches others above as well! -->
    <map>
      <content_in match="regexp">.*readers.*</content_in>
      <content_out>read</content_out>
    </map>
  </named_location>

  
  <!-- *** -->
  <!-- *** bandwidth values -->
  <!-- *** -->
  <named_location>
    <name>T_chld</name>   
    <regexp>Children see throughput for.*initial writers.*=</regexp>
  </named_location>

  <named_location>
    <name>T_prnt</name>   
    <regexp>Parent sees throughput for.*initial writers.*=</regexp>
  </named_location>

  <named_location>
    <name>T_min</name>   
    <regexp>Min throughput per process.*=</regexp>
  </named_location>

  <named_location>
    <name>T_max</name>   
    <regexp>Max throughput per process.*=</regexp>
  </named_location>

  <named_location>
    <name>T_avg</name>   
    <regexp>Avg throughput per process.*=</regexp>
  </named_location>

  <named_location mode="set">
    <name>S_xmin</name>   
    <regexp>Min xfer.*=</regexp>
  </named_location>

</input>

