<?xml version="1.0" standalone="no"?>
<!DOCTYPE input SYSTEM "../../dtd/pb_input.dtd">

<input>
  <experiment>regexp2_TEST</experiment>
  
  <named_location len="0">
    <name>D</name>
    <match>description:</match>
  </named_location>

  <named_location>
    <name>N</name>
    <match>data:</match>
  </named_location>

</input>
