<?xml version="1.0" standalone="no"?>
<!DOCTYPE input SYSTEM "../../dtd/pb_input.dtd">

<input>
  <experiment>derived_TEST</experiment>
  
  <named_location>
    <name>N_nodes</name>
    <match>nbr_nodes =</match>
  </named_location>

  <tabular_location>
      <match># n_ppn</match>
      <skip>1</skip>
      
    <tabular_value>
      <name>N_ppn</name>
      <pos>0</pos>
    </tabular_value>

    <tabular_value>
      <name>T</name>
      <pos>1</pos>
    </tabular_value>
  </tabular_location>

  <derived_parameter>
    <name>N_procs</name>
    <term>      
      <product>
	<factor><parameter>N_nodes</parameter></factor>
	<factor><parameter>N_ppn</parameter></factor>
      </product>
    </term>
  </derived_parameter>

</input>
