<?xml version="1.0" standalone="no"?>
<!DOCTYPE input SYSTEM "../../dtd/pb_input.dtd">

<input>
  <experiment>multi_TEST</experiment>

  <tabular_location columns="2">
    <match># msg_size</match>
    <skip>1</skip>

    <tabular_value>
      <name>S_msg</name>
      <pos>0</pos>
    </tabular_value>

    <tabular_value>
      <name>CPU_load</name>
      <pos>1</pos>
    </tabular_value>
  </tabular_location>

</input>
