<?xml version="1.0" standalone="no"?>
<!DOCTYPE input SYSTEM "../../dtd/pb_input.dtd">

<input>
  <experiment>plain_table_TEST</experiment>

  <tabular_location columns="2">
    <match></match>

    <tabular_value>
      <name>S_msg</name>
      <pos>0</pos>
    </tabular_value>

    <tabular_value>
      <name>T_pp</name>
      <pos>1</pos>
    </tabular_value>
  </tabular_location>
</input>
