<?xml version="1.0" standalone="no"?>
<!DOCTYPE input SYSTEM "../../dtd/pb_input.dtd">

<input>
  <experiment>amput_DEMO</experiment>

  <filename_location>
    <name>T</name>
    <match match="exact">_T</match>
  </filename_location>

  <tabular_location>
    <tabular_value>
      <name>S</name>
      <pos>0</pos>
    </tabular_value>

    <tabular_value>
      <name>P</name>
      <pos>1</pos>
    </tabular_value>
  </tabular_location>

</input>
