<?xml version="1.0" standalone="no"?>
<!DOCTYPE input SYSTEM "../../dtd/pb_input.dtd">

<input>
  <experiment>combiner2_TEST</experiment>

  <tabular_location>
    <match># msg_size</match>
    <skip>1</skip>
    
    <tabular_value>
      <name>S_msg</name>
      <pos>0</pos>
    </tabular_value>
    
    <tabular_value>
      <name>T_pp</name>
      <pos>1</pos>
    </tabular_value>
  </tabular_location>

  <named_location>
    <name>V_net</name>
    <match>speed:</match>
  </named_location>

  <named_location>
    <name>API</name>
    <match>API:</match>
  </named_location>
  
</input>
